[
  {
    "evidence_id": "EVD-001",
    "is_mock": true,
    "source_id": "SRC-001",
    "evidence_text": "演示文本：北岸储能一期规划功率为100 MW。",
    "evidence_grade": "B",
    "relation": "supports",
    "target_type": "metric",
    "target_id": "MET-001",
    "extraction_status": "extracted",
    "human_review_status": "confirmed"
  },
  {
    "evidence_id": "EVD-002",
    "is_mock": true,
    "source_id": "SRC-002",
    "evidence_text": "演示文本：虚构北岸项目已完成备案，储能容量为200 MWh。",
    "evidence_grade": "B",
    "relation": "supports",
    "target_type": "project_event",
    "target_id": "EVT-001",
    "extraction_status": "extracted",
    "human_review_status": "confirmed"
  },
  {
    "evidence_id": "EVD-003",
    "is_mock": true,
    "source_id": "SRC-002",
    "evidence_text": "演示文本：虚构北岸项目储能容量为200 MWh。",
    "evidence_grade": "B",
    "relation": "supports",
    "target_type": "metric",
    "target_id": "MET-002",
    "extraction_status": "extracted",
    "human_review_status": "confirmed"
  },
  {
    "evidence_id": "EVD-004",
    "is_mock": true,
    "source_id": "SRC-003",
    "evidence_text": "演示文本：北岸项目计划投资约8亿元，待交叉核对。",
    "evidence_grade": "C",
    "relation": "supports",
    "target_type": "metric",
    "target_id": "MET-005",
    "extraction_status": "extracted",
    "human_review_status": "review_required"
  },
  {
    "evidence_id": "EVD-005",
    "is_mock": true,
    "source_id": "SRC-004",
    "evidence_text": "演示文本：北岸项目计划投资为9亿元。",
    "evidence_grade": "A",
    "relation": "supports",
    "target_type": "metric",
    "target_id": "MET-006",
    "extraction_status": "extracted",
    "human_review_status": "review_required"
  },
  {
    "evidence_id": "EVD-006",
    "is_mock": true,
    "source_id": "SRC-004",
    "evidence_text": "演示文本：南岭项目由澄岳虚构南岭项目公司负责。",
    "evidence_grade": "A",
    "relation": "supports",
    "target_type": "fact",
    "target_id": "FCT-001",
    "extraction_status": "extracted",
    "human_review_status": "confirmed"
  },
  {
    "evidence_id": "EVD-007",
    "is_mock": true,
    "source_id": "SRC-001",
    "evidence_text": "演示文本：北岸储能一期又称澄岳北岸调峰站。",
    "evidence_grade": "B",
    "relation": "supports",
    "target_type": "fact",
    "target_id": "FCT-002",
    "extraction_status": "extracted",
    "human_review_status": "confirmed"
  },
  {
    "evidence_id": "EVD-008",
    "is_mock": true,
    "source_id": "SRC-004",
    "evidence_text": "演示文本：南岭项目计划启动建设，具体开工日期待确认。",
    "evidence_grade": "A",
    "relation": "supports",
    "target_type": "project_event",
    "target_id": "EVT-003",
    "extraction_status": "extracted",
    "human_review_status": "review_required"
  },
  {
    "evidence_id": "EVD-009",
    "is_mock": true,
    "source_id": "SRC-003",
    "evidence_text": "演示文本：北岸项目已启动建设。",
    "evidence_grade": "C",
    "relation": "supports",
    "target_type": "project_event",
    "target_id": "EVT-002",
    "extraction_status": "extracted",
    "human_review_status": "review_required"
  },
  {
    "evidence_id": "EVD-010",
    "is_mock": true,
    "source_id": "SRC-004",
    "evidence_text": "演示文本：南岭项目拟配置50 MW功率。",
    "evidence_grade": "A",
    "relation": "supports",
    "target_type": "metric",
    "target_id": "MET-003",
    "extraction_status": "extracted",
    "human_review_status": "confirmed"
  },
  {
    "evidence_id": "EVD-011",
    "is_mock": true,
    "source_id": "SRC-001",
    "evidence_text": "演示文本：北岸项目为独立储能项目。",
    "evidence_grade": "B",
    "relation": "supports",
    "target_type": "fact",
    "target_id": "FCT-005",
    "extraction_status": "extracted",
    "human_review_status": "confirmed"
  },
  {
    "evidence_id": "EVD-012",
    "is_mock": true,
    "source_id": "SRC-004",
    "evidence_text": "演示文本：南岭项目为新能源配储项目。",
    "evidence_grade": "A",
    "relation": "supports",
    "target_type": "fact",
    "target_id": "FCT-006",
    "extraction_status": "extracted",
    "human_review_status": "confirmed"
  },
  {
    "evidence_id": "EVD-013",
    "is_mock": true,
    "source_id": "SRC-004",
    "evidence_text": "演示文本：北岸项目功率规模为100 MW。",
    "evidence_grade": "A",
    "relation": "supports",
    "target_type": "metric",
    "target_id": "MET-001",
    "extraction_status": "extracted",
    "human_review_status": "confirmed"
  }
]
